[
  {
    "name": "bead-create",
    "facts": [
      {
        "resourceKind": "bead",
        "transition": "created",
        "resourceId": "https://example.invalid/s/beads/a",
        "newRevision": "a-r1",
        "initialState": {
          "title": "A"
        }
      }
    ],
    "visibleFactIndexes": [0],
    "expectedValid": true,
    "expectedCounts": {
      "facts": 1,
      "bead": 1,
      "link": 0
    }
  },
  {
    "name": "bead-delta",
    "facts": [
      {
        "resourceKind": "bead",
        "transition": "updated",
        "resourceId": "https://example.invalid/s/beads/a",
        "previousRevision": "a-r1",
        "newRevision": "a-r2",
        "delta": {
          "properties": {
            "title": "B"
          }
        }
      }
    ],
    "visibleFactIndexes": [0],
    "expectedValid": true,
    "expectedCounts": {
      "facts": 1,
      "bead": 1,
      "link": 0
    }
  },
  {
    "name": "pinned-link-delete",
    "facts": [
      {
        "resourceKind": "link",
        "transition": "deleted",
        "resourceId": "https://example.invalid/s/links/l",
        "recordedRevision": "l-r1",
        "linkContext": {
          "type": "https://example.invalid/types/association",
          "source": "https://example.invalid/s/beads/a",
          "target": {
            "uri": "https://example.invalid/s/beads/b",
            "revision": "b-r1"
          }
        }
      }
    ],
    "visibleFactIndexes": [0],
    "expectedValid": true,
    "expectedCounts": {
      "facts": 1,
      "bead": 0,
      "link": 1
    }
  },
  {
    "name": "ordinary-incidence-no-bead-version",
    "facts": [
      {
        "resourceKind": "link",
        "transition": "deleted",
        "resourceId": "https://example.invalid/s/links/l",
        "recordedRevision": "l-r1",
        "linkContext": {
          "type": "https://example.invalid/types/association",
          "source": "https://example.invalid/s/beads/a",
          "target": {
            "uri": "https://example.invalid/s/beads/b",
            "revision": "b-r1"
          }
        }
      }
    ],
    "visibleFactIndexes": [0],
    "expectedValid": true,
    "expectedCounts": {
      "facts": 1,
      "bead": 0,
      "link": 1
    }
  },
  {
    "name": "owned-link-plus-source",
    "facts": [
      {
        "resourceKind": "link",
        "transition": "deleted",
        "resourceId": "https://example.invalid/s/links/l",
        "recordedRevision": "l-r1",
        "linkContext": {
          "type": "https://example.invalid/types/association",
          "source": "https://example.invalid/s/beads/a",
          "target": {
            "uri": "https://example.invalid/s/beads/b",
            "revision": "b-r1"
          }
        }
      },
      {
        "resourceKind": "bead",
        "transition": "updated",
        "resourceId": "https://example.invalid/s/beads/a",
        "previousRevision": "a-r1",
        "newRevision": "a-r2",
        "delta": {
          "ownedLinksRemoved": ["https://example.invalid/s/links/l"]
        }
      }
    ],
    "visibleFactIndexes": [0, 1],
    "expectedValid": true,
    "expectedCounts": {
      "facts": 2,
      "bead": 1,
      "link": 1
    }
  },
  {
    "name": "self-link-projected-once",
    "facts": [
      {
        "resourceKind": "link",
        "transition": "deleted",
        "resourceId": "https://example.invalid/s/links/l",
        "recordedRevision": "l-r1",
        "linkContext": {
          "type": "https://example.invalid/types/association",
          "source": "https://example.invalid/s/beads/a",
          "target": "https://example.invalid/s/beads/a"
        }
      }
    ],
    "visibleFactIndexes": [0],
    "expectedValid": true,
    "expectedCounts": {
      "facts": 1,
      "bead": 0,
      "link": 1
    }
  },
  {
    "name": "rollback-zero-facts",
    "facts": [],
    "visibleFactIndexes": [],
    "expectedValid": true,
    "expectedCounts": {
      "facts": 0,
      "bead": 0,
      "link": 0
    }
  },
  {
    "name": "ordinary-no-op-zero-facts",
    "facts": [],
    "visibleFactIndexes": [],
    "expectedValid": true,
    "expectedCounts": {
      "facts": 0,
      "bead": 0,
      "link": 0
    }
  },
  {
    "name": "bead-import",
    "facts": [
      {
        "resourceKind": "bead",
        "transition": "imported",
        "resourceId": "https://example.invalid/s/beads/a",
        "newRevision": "a-import",
        "sourceVersion": {
          "id": "https://example.invalid/s/beads/a",
          "revision": "a-r7"
        }
      }
    ],
    "visibleFactIndexes": [0],
    "expectedValid": true,
    "expectedCounts": {
      "facts": 1,
      "bead": 1,
      "link": 0
    }
  },
  {
    "name": "link-import",
    "facts": [
      {
        "resourceKind": "link",
        "transition": "imported",
        "resourceId": "https://example.invalid/s/links/l",
        "newRevision": "l-import",
        "sourceVersion": {
          "id": "https://example.invalid/s/links/l",
          "revision": "l-r7"
        }
      }
    ],
    "visibleFactIndexes": [0],
    "expectedValid": true,
    "expectedCounts": {
      "facts": 1,
      "bead": 0,
      "link": 1
    }
  },
  {
    "name": "missing-delete-context",
    "facts": [
      {
        "resourceKind": "link",
        "transition": "deleted",
        "resourceId": "https://example.invalid/s/links/l",
        "recordedRevision": "l-r1"
      }
    ],
    "visibleFactIndexes": [0],
    "expectedValid": false,
    "expectedCounts": {
      "facts": 1,
      "bead": 0,
      "link": 1
    }
  },
  {
    "name": "update-postimage-only",
    "facts": [
      {
        "resourceKind": "bead",
        "transition": "updated",
        "resourceId": "https://example.invalid/s/beads/a",
        "previousRevision": "a-r1",
        "newRevision": "a-r2",
        "initialState": {
          "title": "B"
        }
      }
    ],
    "visibleFactIndexes": [0],
    "expectedValid": false,
    "expectedCounts": {
      "facts": 1,
      "bead": 1,
      "link": 0
    }
  },
  {
    "name": "old-incidence-kind",
    "facts": [
      {
        "resourceKind": "link",
        "transition": "unlinked",
        "resourceId": "https://example.invalid/s/links/l",
        "recordedRevision": "l-r1",
        "linkContext": {
          "type": "https://example.invalid/types/association",
          "source": "https://example.invalid/s/beads/a",
          "target": {
            "uri": "https://example.invalid/s/beads/b",
            "revision": "b-r1"
          }
        }
      }
    ],
    "visibleFactIndexes": [0],
    "expectedValid": false,
    "expectedCounts": {
      "facts": 1,
      "bead": 0,
      "link": 1
    }
  },
  {
    "name": "duplicate-self-projection",
    "facts": [
      {
        "resourceKind": "link",
        "transition": "deleted",
        "resourceId": "https://example.invalid/s/links/l",
        "recordedRevision": "l-r1",
        "linkContext": {
          "type": "https://example.invalid/types/association",
          "source": "https://example.invalid/s/beads/a",
          "target": "https://example.invalid/s/beads/a"
        }
      }
    ],
    "visibleFactIndexes": [0, 0],
    "expectedValid": false,
    "expectedCounts": {
      "facts": 1,
      "bead": 0,
      "link": 1
    }
  },
  {
    "name": "missing-import-source",
    "facts": [
      {
        "resourceKind": "bead",
        "transition": "imported",
        "resourceId": "https://example.invalid/s/beads/a",
        "newRevision": "a-import"
      }
    ],
    "visibleFactIndexes": [0],
    "expectedValid": false,
    "expectedCounts": {
      "facts": 1,
      "bead": 1,
      "link": 0
    }
  },
  {
    "name": "update-delta-plus-postimage",
    "facts": [
      {
        "resourceKind": "bead",
        "transition": "updated",
        "resourceId": "https://example.invalid/s/beads/a",
        "previousRevision": "a-r1",
        "newRevision": "a-r2",
        "delta": {
          "properties": {
            "title": "B"
          }
        },
        "initialState": {
          "title": "B"
        }
      }
    ],
    "visibleFactIndexes": [0],
    "expectedValid": false,
    "expectedCounts": {
      "facts": 1,
      "bead": 1,
      "link": 0
    }
  },
  {
    "name": "ordinary-incidence-extra-bead-refuses",
    "facts": [
      {
        "resourceKind": "link",
        "transition": "deleted",
        "resourceId": "https://example.invalid/s/links/l",
        "recordedRevision": "l-r1",
        "linkContext": {
          "type": "https://example.invalid/types/association",
          "source": "https://example.invalid/s/beads/a",
          "target": {
            "uri": "https://example.invalid/s/beads/b",
            "revision": "b-r1"
          }
        }
      },
      {
        "resourceKind": "bead",
        "transition": "created",
        "resourceId": "https://example.invalid/s/beads/a",
        "newRevision": "a-r1",
        "initialState": {
          "title": "A"
        }
      }
    ],
    "visibleFactIndexes": [0, 1],
    "expectedValid": false,
    "expectedCounts": {
      "facts": 1,
      "bead": 0,
      "link": 1
    }
  },
  {
    "name": "owned-link-missing-source-refuses",
    "facts": [
      {
        "resourceKind": "link",
        "transition": "deleted",
        "resourceId": "https://example.invalid/s/links/l",
        "recordedRevision": "l-r1",
        "linkContext": {
          "type": "https://example.invalid/types/association",
          "source": "https://example.invalid/s/beads/a",
          "target": {
            "uri": "https://example.invalid/s/beads/b",
            "revision": "b-r1"
          }
        }
      }
    ],
    "visibleFactIndexes": [0],
    "expectedValid": false,
    "expectedCounts": {
      "facts": 2,
      "bead": 1,
      "link": 1
    }
  },
  {
    "name": "rollback-extra-fact-refuses",
    "facts": [
      {
        "resourceKind": "bead",
        "transition": "created",